id,title,abstract,checked_by,kes_check,hji_check,curation_sum,number_of_checks,curation_score,kes_notes,hji_notes,index,next_step
27350137,Analysis of Transitional and Turbulent Flow Through the FDA Benchmark Nozzle Model Using Laser Doppler Velocimetry.,"Transitional and turbulent flow through a simplified medical device model is analyzed as part of the FDA's Critical Path Initiative, designed to improve the process of bringing medical products to market. Computational predictions are often used in the development of devices and reliable in vitro data is needed to validate computational results, particularly estimations of the Reynolds stresses that could play a role in damaging blood elements. The high spatial resolution of laser Doppler velocimetry (LDV) is used to collect two component velocity data within the FDA benchmark nozzle model. Two flow conditions are used to produce flow encompassing laminar, transitional, and turbulent regimes, and viscous stresses, principal Reynolds stresses, and turbulence intensities are calculated from the measured LDV velocities. Axial velocities and viscous stresses are compared to data from a prior inter-laboratory study conducted with particle image velocimetry. Large velocity gradients are observed near the wall in the nozzle throat and in the jet shear layer located in the expansion downstream of the throat, with axial velocity changing as much as 4.5m/s over 200m. Additionally, maximum Reynolds shear stresses of 1000-2000Pa are calculated in the high shear regions, which are an order of magnitude higher than the peak viscous shear stresses (<100Pa). It is important to consider the effects of both viscous and turbulent stresses when simulating flow through medical devices. Reynolds stresses above commonly accepted hemolysis thresholds are measured in the nozzle model, indicating that hemolysis may occur under certain flow conditions. As such, the presented turbulence quantities from LDV, which are also available for download at https://fdacfd.nci.nih.gov/ , provide an ideal validation test for computational simulations that seek to characterize the flow field and to predict hemolysis within the FDA nozzle geometry.","hji,kes",0,1,1,2,0.5,,iffy; reassessed and still yes - there is data there but it is iffy,884,
27450113,The archiving and dissemination of biological structure data.,"The global Protein Data Bank (PDB) was the first open-access digital archive in biology. The history and evolution of the PDB are described, together with the ways in which molecular structural biology data and information are collected, curated, validated, archived, and disseminated by the members of the Worldwide Protein Data Bank organization (wwPDB; http://wwpdb.org). Particular emphasis is placed on the role of community in establishing the standards and policies by which the PDB archive is managed day-to-day.","hji,kes",0,1,1,2,0.5,,no notes; reassessed and still yes - includes a data resource ,885,kes review
27509041,MMpI: A WideRange of Available Compounds of Matrix Metalloproteinase Inhibitors.,"Matrix metalloproteinases (MMPs) are a family of zinc-dependent proteinases involved in the regulation of the extracellular signaling and structural matrix environment of cells and tissues. MMPs are considered as promising targets for the treatment of many diseases. Therefore, creation of database on the inhibitors of MMP would definitely accelerate the research activities in this area due to its implication in above-mentioned diseases and associated limitations in the first and second generation inhibitors. In this communication, we report the development of a new MMpI database which provides resourceful information for all researchers working in this field. It is a web-accessible, unique resource that contains detailed information on the inhibitors of MMP including small molecules, peptides and MMP Drug Leads. The database contains entries of ~3000 inhibitors including ~72 MMP Drug Leads and ~73 peptide based inhibitors. This database provides the detailed molecular and structural details which are necessary for the drug discovery and development. The MMpI database contains physical properties, 2D and 3D structures (mol2 and pdb format files) of inhibitors of MMP. Other data fields are hyperlinked to PubChem, ChEMBL, BindingDB, DrugBank, PDB, MEROPS and PubMed. The database has extensive searching facility with MMpI ID, IUPAC name, chemical structure and with the title of research article. The MMP inhibitors provided in MMpI database are optimized using Python-based Hierarchical Environment for Integrated Xtallography (Phenix) software. MMpI Database is unique and it is the only public database that contains and provides the complete information on the inhibitors of MMP. Database URL: http://clri.res.in/subramanian/databases/mmpi/index.php.","hji,kes",0,1,1,2,0.5,,no notes; reassessed and still yes - includes a data resource ,886,kes review
27551106,PPI4DOCK: large scale assessment of the use of homology models in free docking over more than 1000 realistic targets.,"<h4>Motivation</h4>Protein-protein docking methods are of great importance for understanding interactomes at the structural level. It has become increasingly appealing to use not only experimental structures but also homology models of unbound subunits as input for docking simulations. So far we are missing a large scale assessment of the success of rigid-body free docking methods on homology models.<h4>Results</h4>We explored how we could benefit from comparative modelling of unbound subunits to expand docking benchmark datasets. Starting from a collection of 3157 non-redundant, high X-ray resolution heterodimers, we developed the PPI4DOCK benchmark containing 1417 docking targets based on unbound homology models. Rigid-body docking by Zdock showed that for 1208 cases (85.2%), at least one correct decoy was generated, emphasizing the efficiency of rigid-body docking in generating correct assemblies. Overall, the PPI4DOCK benchmark contains a large set of realistic cases and provides new ground for assessing docking and scoring methodologies.<h4>Availability and implementation</h4>Benchmark sets can be downloaded from http://biodev.cea.fr/interevol/ppi4dock/ CONTACT: guerois@cea.frSupplementary information: Supplementary data are available at Bioinformatics online.","hji,kes",0,1,1,2,0.5,,benchmarking data available; reassessed and still yes - data available,887,discuss
27554092,Training and evaluation corpora for the extraction of causal relationships encoded in biological expression language (BEL).,"Success in extracting biological relationships is mainly dependent on the complexity of the task as well as the availability of high-quality training data. Here, we describe the new corpora in the systems biology modeling language BEL for training and testing biological relationship extraction systems that we prepared for the BioCreative V BEL track. BEL was designed to capture relationships not only between proteins or chemicals, but also complex events such as biological processes or disease states. A BEL nanopub is the smallest unit of information and represents a biological relationship with its provenance. In BEL relationships (called BEL statements), the entities are normalized to defined namespaces mainly derived from public repositories, such as sequence databases, MeSH or publicly available ontologies. In the BEL nanopubs, the BEL statements are associated with citation information and supportive evidence such as a text excerpt. To enable the training of extraction tools, we prepared BEL resources and made them available to the community. We selected a subset of these resources focusing on a reduced set of namespaces, namely, human and mouse genes, ChEBI chemicals, MeSH diseases and GO biological processes, as well as relationship types 'increases' and 'decreases'. The published training corpus contains 11 000 BEL statements from over 6000 supportive text excerpts. For method evaluation, we selected and re-annotated two smaller subcorpora containing 100 text excerpts. For this re-annotation, the inter-annotator agreement was measured by the BEL track evaluation environment and resulted in a maximal F-score of 91.18% for full statement agreement. In addition, for a set of 100 BEL statements, we do not only provide the gold standard expert annotations, but also text excerpts pre-selected by two automated systems. Those text excerpts were evaluated and manually annotated as true or false supportive in the course of the BioCreative V BEL track task.Database URL: http://wiki.openbel.org/display/BIOC/Datasets.","hji,kes",0,1,1,2,0.5,,value add and available; reassessed and still yes - data available,888,
27779621,"A studyforrest extension, simultaneous fMRI and eye gaze recordings during prolonged natural stimulation.","Here we present an update of the studyforrest (http://studyforrest.org) dataset that complements the previously released functional magnetic resonance imaging (fMRI) data for natural language processing with a new two-hour 3 Tesla fMRI acquisition while 15 of the original participants were shown an audio-visual version of the stimulus motion picture. We demonstrate with two validation analyses that these new data support modeling specific properties of the complex natural stimulus, as well as a substantial within-subject BOLD response congruency in brain areas related to the processing of auditory inputs, speech, and narrative when compared to the existing fMRI data for audio-only stimulation. In addition, we provide participants' eye gaze location as recorded simultaneously with fMRI, and an additional sample of 15 control participants whose eye gaze trajectories for the entire movie were recorded in a lab setting-to enable studies on attentional processes and comparative investigations on the potential impact of the stimulation setting on these processes.","hji,kes",0,1,1,2,0.5,,no notes; reassessed and still yes - data set,889,kes review
27899584,CATH: an expanded resource to predict protein function through structure and sequence.,"The latest version of the CATH-Gene3D protein structure classification database has recently been released (version 4.1, http://www.cathdb.info). The resource comprises over 300 000 domain structures and over 53 million protein domains classified into 2737 homologous superfamilies, doubling the number of predicted protein domains in the previous version. The daily-updated CATH-B, which contains our very latest domain assignment data, provides putative classifications for over 100 000 additional protein domains. This article describes developments to the CATH-Gene3D resource over the last two years since the publication in 2015, including: significant increases to our structural and sequence coverage; expansion of the functional families in CATH; building a support vector machine (SVM) to automatically assign domains to superfamilies; improved search facilities to return alignments of query sequences against multiple sequence alignments; the redesign of the web pages and download site.","hji,kes",0,1,1,2,0.5,,no notes; reassessed and still yes - includes a data resource ,890,kes review
28053162,POSTAR: a platform for exploring post-transcriptional regulation coordinated by RNA-binding proteins.,"We present POSTAR (http://POSTAR.ncrnalab.org), a resource of POST-trAnscriptional Regulation coordinated by RNA-binding proteins (RBPs). Precise characterization of post-transcriptional regulatory maps has accelerated dramatically in the past few years. Based on new studies and resources, POSTAR supplies the largest collection of experimentally probed (~23 million) and computationally predicted (approximately 117 million) RBP binding sites in the human and mouse transcriptomes. POSTAR annotates every transcript and its RBP binding sites using extensive information regarding various molecular regulatory events (e.g., splicing, editing, and modification), RNA secondary structures, disease-associated variants, and gene expression and function. Moreover, POSTAR provides a friendly, multi-mode, integrated search interface, which helps users to connect multiple RBP binding sites with post-transcriptional regulatory events, phenotypes, and diseases. Based on our platform, we were able to obtain novel insights into post-transcriptional regulation, such as the putative association between CPSF6 binding, RNA structural domains, and Li-Fraumeni syndrome SNPs. In summary, POSTAR represents an early effort to systematically annotate post-transcriptional regulatory maps and explore the putative roles of RBPs in human diseases.","hji,kes",0,1,1,2,0.5,,"no notes; reassessed and still yes - includes a data resource, collection of binding sites",891,kes review
28633399,The interfacial character of antibody paratopes: analysis of antibody-antigen structures.,"<h4>Summary</h4>In this study, computational methods are applied to investigate the general properties of antigen engaging residues of a paratope from a non-redundant dataset of 403 antibody-antigen complexes to dissect the contribution of hydrogen bonds, hydrophobic, van der Waals contacts and ionic interactions, as well as role of water molecules in the antigen-antibody interface. Consistent with previous reports using smaller datasets, we found that Tyr, Trp, Ser, Asn, Asp, Thr, Arg, Gly, His contribute substantially to the interactions between antibody and antigen. Furthermore, antibody-antigen interactions can be mediated by interfacial waters. However, there is no reported comprehensive analysis for a large number of structured waters that engage in higher ordered structures at the antibody-antigen interface. From our dataset, we have found the presence of interfacial waters in 242 complexes. We present evidence that suggests a compelling role of these interfacial waters in interactions of antibodies with a range of antigens differing in shape complementarity. Finally, we carry out 296 835 pairwise 3D structure comparisons of 771 structures of contact residues of antibodies with their interfacial water molecules from our dataset using CLICK method. A heuristic clustering algorithm is used to obtain unique structural similarities, and found to separate into 368 different clusters. These clusters are used to identify structural motifs of contact residues of antibodies for epitope binding.<h4>Availability and implementation</h4>This clustering database of contact residues is freely accessible at http://mspc.bii.a-star.edu.sg/minhn/pclick.html.<h4>Contact</h4>minhn@bii.a-star.edu.sg, chandra@bii.a-star.edu.sg or zhong_pingyu@immunol.a-star.edu.sg.<h4>Supplementary information</h4>Supplementary data are available at Bioinformatics online.","hji,kes",0,1,1,2,0.5,,no notes; reassessed and still yes - includes a data resource of cluster residues - output of model,892,kes review
28827280,Systematic and Quantitative Assessment of Hydrogen Peroxide Reactivity With Cysteines Across Human Proteomes.,"Protein cysteinyl residues are the mediators of hydrogen peroxide (H<sub>2</sub>O<sub>2</sub>)-dependent redox signaling. However, site-specific mapping of the selectivity and dynamics of these redox reactions in cells poses a major analytical challenge. Here we describe a chemoproteomic platform to systematically and quantitatively analyze the reactivity of thousands of cysteines toward H<sub>2</sub>O<sub>2</sub> in human cells. We identified >900 H<sub>2</sub>O<sub>2</sub>-sensitive cysteines, which are defined as the H<sub>2</sub>O<sub>2</sub>-dependent redoxome. Although redox sites associated with antioxidative and metabolic functions are consistent, most of the H<sub>2</sub>O<sub>2</sub>-dependent redoxome varies dramatically between different cells. Structural analyses reveal that H<sub>2</sub>O<sub>2</sub>-sensitive cysteines are less conserved than their redox-insensitive counterparts and display distinct sequence motifs, structural features, and potential for crosstalk with lysine modifications. Notably, our chemoproteomic platform also provides an opportunity to predict oxidation-triggered protein conformational changes. The data are freely accessible as a resource at http://redox.ncpsb.org/OXID/.","hji,kes",0,1,1,2,0.5,,no notes; reassessed and still yes - includes a data resource ,893,kes review
28968848,A comprehensive assessment of long intrinsic protein disorder from the DisProt database.,"<h4>Motivation</h4>Intrinsic disorder (ID), i.e. the lack of a unique folded conformation at physiological conditions, is a common feature for many proteins, which requires specialized biochemical experiments that are not high-throughput. Missing X-ray residues from the PDB have been widely used as a proxy for ID when developing computational methods. This may lead to a systematic bias, where predictors deviate from biologically relevant ID. Large benchmarking sets on experimentally validated ID are scarce. Recently, the DisProt database has been renewed and expanded to include manually curated ID annotations for several hundred new proteins. This provides a large benchmark set which has not yet been used for training ID predictors.<h4>Results</h4>Here, we describe the first systematic benchmarking of ID predictors on the new DisProt dataset. In contrast to previous assessments based on missing X-ray data, this dataset contains mostly long ID regions and a significant amount of fully ID proteins. The benchmarking shows that ID predictors work quite well on the new dataset, especially for long ID segments. However, a large fraction of ID still goes virtually undetected and the ranking of methods is different than for PDB data. In particular, many predictors appear to confound ID and regions outside X-ray structures. This suggests that the ID prediction methods capture different flavors of disorder and can benefit from highly accurate curated examples.<h4>Availability and implementation</h4>The raw data used for the evaluation are available from URL: http://www.disprot.org/assessment/.<h4>Contact</h4>silvio.tosatto@unipd.it.<h4>Supplementary information</h4>Supplementary data are available at Bioinformatics online.","hji,kes",0,1,1,2,0.5,,no notes; reassessed and still yes - data set,894,kes review
29039006,Information Resources for Functional Genomics Studies in Brachypodium distachyon.,"Online tools and databases play an essential role in the promotion of functional genomics studies. Several resources for information regarding Brachypodium distachyon (Brachypodium) are available on the Web. In this chapter, we focus on recently published resources for Brachypodium research. The Brachypodium.org website ( http://www.brachypodium.org /) is an information portal that provides links to various genomic resources regarding Brachypodium, including genome annotation and re-sequencing datasets of accessions. RIKEN Full-length cDNA Database (RBFLDB, http://brachy.bmep.riken.jp/ver.1/index.pl ) is a web-accessible database that provides information of Brachypodium full-length cDNAs (FLcDNAs) collected in RIKEN and updated gene structures of Brachypodium based on the FLcDNA sequences as well as results of comparative analyses with available sequence resources for Triticeae crops, wheat, and barley. We introduce the functionalities and availability of these important information resources. Furthermore, we also present brief descriptions of useful online tools that facilitate Brachypodium functional genomics studies.","hji,kes",0,1,1,2,0.5,,"no notes; reassessed and still yes - includes a data resource, possibly two - one a knowledgebase and another data resource ",895,discuss
29155427,PDB-wide identification of biological assemblies from conserved quaternary structure geometry.,"Protein structures are key to understanding biomolecular mechanisms and diseases, yet their interpretation is hampered by limited knowledge of their biologically relevant quaternary structure (QS). A critical challenge in inferring QS information from crystallographic data is distinguishing biological interfaces from fortuitous crystal-packing contacts. Here, we tackled this problem by developing strategies for aligning and comparing QS states across both homologs and data repositories. QS conservation across homologs proved remarkably strong at predicting biological relevance and is implemented in two methods, QSalign and anti-QSalign, for annotating homo-oligomers and monomers, respectively. QS conservation across repositories is implemented in QSbio (http://www.QSbio.org), which approaches the accuracy of manual curation and allowed us to predict >100,000 QS states across the Protein Data Bank. Based on this high-quality data set, we analyzed pairs of structurally conserved interfaces, and this analysis revealed a striking plasticity whereby evolutionary distant interfaces maintain similar interaction geometries through widely divergent chemical properties.","hji,kes",0,0,0,2,0,,iffy; reassessed and re-scored - not clear from abstract what is available,896,
29161266,Knowledge-based prediction of protein backbone conformation using a structural alphabet.,"Libraries of structural prototypes that abstract protein local structures are known as structural alphabets and have proven to be very useful in various aspects of protein structure analyses and predictions. One such library, Protein Blocks, is composed of 16 standard 5-residues long structural prototypes. This form of analyzing proteins involves drafting its structure as a string of Protein Blocks. Predicting the local structure of a protein in terms of protein blocks is the general objective of this work. A new approach, PB-kPRED is proposed towards this aim. It involves (i) organizing the structural knowledge in the form of a database of pentapeptide fragments extracted from all protein structures in the PDB and (ii) applying a knowledge-based algorithm that does not rely on any secondary structure predictions and/or sequence alignment profiles, to scan this database and predict most probable backbone conformations for the protein local structures. Though PB-kPRED uses the structural information from homologues in preference, if available. The predictions were evaluated rigorously on 15,544 query proteins representing a non-redundant subset of the PDB filtered at 30% sequence identity cut-off. We have shown that the kPRED method was able to achieve mean accuracies ranging from 40.8% to 66.3% depending on the availability of homologues. The impact of the different strategies for scanning the database on the prediction was evaluated and is discussed. Our results highlight the usefulness of the method in the context of proteins without any known structural homologues. A scoring function that gives a good estimate of the accuracy of prediction was further developed. This score estimates very well the accuracy of the algorithm (R2 of 0.82). An online version of the tool is provided freely for non-commercial usage at http://www.bo-protscience.fr/kpred/.","hji,kes",0,0,0,2,0,,"value add and available; reassessed and re-scored, seems to focus on method only",897,
29220450,CTD2 Dashboard: a searchable web interface to connect validated results from the Cancer Target Discovery and Development Network.,<h4>Database url</h4>https://ctd2-dashboard.nci.nih.gov/.,"hji,kes",0,0,0,2,0,,"value add; reassessed and re-scored, abstract error",898,
29296922,Standard measures for sickle cell disease research: the PhenX Toolkit sickle cell disease collections.,"Standard measures and common data elements for sickle cell disease (SCD) will improve the data quality and comparability necessary for cross-study analyses and the development of guidelines that support effective treatments and interventions. In 2014, the National Institutes of Health, National Heart, Lung, and Blood Institute (NHLBI) funded an Administrative Supplement to the PhenX Toolkit (consensus measures for Phenotypes and eXposures; https://www.phenxtoolkit.org/) to identify common measures to promote data comparability across SCD research. An 11-member Sickle Cell Disease Research and Scientific Panel provided guidance to the project, establishing a core collection of SCD-related measures and defining the scope of 2 specialty collections: (1) cardiovascular, pulmonary, and renal complications, and (2) neurology, quality-of-life, and health services. For each specialty collection, a working group of SCD experts selected high-priority measures using a consensus process that included scientific community input. The SCD measures were released into the Toolkit in August 2015. The 25 measures included in the core collection are recommended for use by all NHLBI-funded investigators performing human-subject SCD research. The 10 neurology, quality-of-life, and health services measures and 14 cardiovascular, pulmonary, and renal measures are recommended for use within these specialized research areas. For SCD and other researchers, PhenX measures will promote collaborations with clinicians and patients, facilitate cross-study analysis, accelerate translational research, and lead to greater understanding of SCD phenotypes and epigenetics. For clinicians, using PhenX measures will help elucidate the etiology, progression, and treatment of SCD, leading to improved patient care and quality of life.","hji,kes",0,0,0,2,0,,no notes; reassessed and re-scored - not a collection of data it seems,899,
