id,title,abstract,checked_by,kes_check,hji_check,curation_sum,number_of_checks,curation_score,kes_notes,hji_notes,index,next_step
28791657,MEGALEX: A megastudy of visual and auditory word recognition.,"Using the megastudy approach, we report a new database (MEGALEX) of visual and auditory lexical decision times and accuracy rates for tens of thousands of words. We collected visual lexical decision data for 28,466 French words and the same number of pseudowords, and auditory lexical decision data for 17,876 French words and the same number of pseudowords (synthesized tokens were used for the auditory modality). This constitutes the first large-scale database for auditory lexical decision, and the first database to enable a direct comparison of word recognition in different modalities. Different regression analyses were conducted to illustrate potential ways to exploit this megastudy database. First, we compared the proportions of variance accounted for by five word frequency measures. Second, we conducted item-level regression analyses to examine the relative importance of the lexical variables influencing performance in the different modalities (visual and auditory). Finally, we compared the similarities and differences between the two modalities. All data are freely available on our website ( https://sedufau.shinyapps.io/megalex/ ) and are searchable at www.lexique.org , inside the Open Lexique search engine.","hji,kes",1,1,2,2,1,visual and lexical db,not life sci; reassessed and re-scored - re-score based on broaded def of life sci,1,
29718389,An update on PUG-REST: RESTful interface for programmatic access to PubChem.,"PubChem (https://pubchem.ncbi.nlm.nih.gov) is one of the largest open chemical information resources available. It currently receives millions of unique users per month on average, serving as a key resource for many research fields such as cheminformatics, chemical biology, medicinal chemistry, and drug discovery. PubChem provides multiple programmatic access routes to its data and services. One of them is PUG-REST, a Representational State Transfer (REST)-like web service interface to PubChem. On average, PUG-REST receives more than a million requests per day from tens of thousands of unique users. The present paper provides an update on PUG-REST since our previous paper published in 2015. This includes access to new kinds of data (e.g. concise bioactivity data, table of contents headings, etc.), full implementation of synchronous fast structure search, support for assay data retrieval using accession identifiers in response to the deprecation of NCBI's GI numbers, data exchange between PUG-REST and NCBI's E-Utilities through the List Gateway, implementation of dynamic traffic control through throttling, and enhanced usage policies. In addition, example Perl scripts are provided, which the user can easily modify, run, or translate into another scripting language.","hji,kes",1,1,2,2,1,description of an interface to PubChem,"no notes; reassessed and re-scored - too strictly read ""service"" before - URL and name match to pubchem itself",9,
30445657,"The European Bioinformatics Institute in 2018: tools, infrastructure and training.","The European Bioinformatics Institute (https://www.ebi.ac.uk/) archives, curates and analyses life sciences data produced by researchers throughout the world, and makes these data available for re-use globally (https://www.ebi.ac.uk/). Data volumes continue to grow exponentially: total raw storage capacity now exceeds 160 petabytes, and we manage these increasing data flows while maintaining the quality of our services. This year we have improved the efficiency of our computational infrastructure and doubled the bandwidth of our connection to the worldwide web. We report two new data resources, the Single Cell Expression Atlas (https://www.ebi.ac.uk/gxa/sc/), which is a component of the Expression Atlas; and the PDBe-Knowledgebase (https://www.ebi.ac.uk/pdbe/pdbe-kb), which collates functional annotations and predictions for structure data in the Protein Data Bank. Additionally, Europe PMC (http://europepmc.org/) has added preprint abstracts to its search results, supplementing results from peer-reviewed publications. EMBL-EBI maintains over 150 analytical bioinformatics tools that complement our data resources. We make these tools available for users through a web interface as well as programmatically using application programming interfaces, whilst ensuring the latest versions are available for our users. Our training team, with support from all of our staff, continued to provide on-site, off-site and web-based training opportunities for thousands of researchers worldwide this year.","hji,kes",1,1,2,2,1,2 data resources: Single cell Expression Atlas and PDBe-Knowledgebase,EBI not a data resource in and of itself; reassessed and re-scored - describes distinct resources in abstract,16,
31501868,Diurnal.plant.tools: Comparative Transcriptomic and Co-expression Analyses of Diurnal Gene Expression of the Archaeplastida Kingdom.,"Almost all organisms coordinate some aspects of their biology through the diurnal cycle. Photosynthetic organisms, and plants especially, have established complex programs that coordinate physiological, metabolic and developmental processes with the changing light. The diurnal regulation of the underlying transcriptional processes is observed when groups of functionally related genes (gene modules) are expressed at a specific time of the day. However, studying the diurnal regulation of these gene modules in the plant kingdom was hampered by the large amount of data required for the analyses. To meet this need, we used gene expression data from 17 diurnal studies spanning the whole Archaeplastida kingdom (Plantae kingdom in the broad sense) to make an online diurnal database. We have equipped the database with tools that allow user-friendly cross-species comparisons of gene expression profiles, entire co-expression networks, co-expressed clusters (involved in specific biological processes), time-specific gene expression and others. We exemplify how these tools can be used by studying three important biological questions: (i) the evolution of cell division, (ii) the diurnal control of gene modules in algae and (iii) the conservation of diurnally controlled modules across species. The database is freely available at http://diurnal.plant.tools.","hji,kes",1,1,2,2,1,database and software tools,no notes; reassessed and re-scored - seems to be value add,37,
31589313,WASPS: web-assisted symbolic plasmid synteny server.,"<h4>Motivation</h4>Comparative plasmid genome analyses require complex tools, the manipulation of large numbers of sequences and constitute a daunting task for the wet bench experimentalist. Dedicated plasmid databases are sparse, only comprise bacterial plasmids and provide exclusively access to sequence similarity searches.<h4>Results</h4>We have developed Web-Assisted Symbolic Plasmid Synteny (WASPS), a web service granting protein and DNA sequence similarity searches against a database comprising all completely sequenced natural plasmids from bacterial, archaeal and eukaryal origin. This database pre-calculates orthologous protein clustering and enables WASPS to generate fully resolved plasmid synteny maps in real time using internal and user-provided DNA sequences.<h4>Availability and implementation</h4>WASPS queries befit all current browsers such as Firefox, Edge or Safari while the best functionality is achieved with Chrome. Internet Explorer is not supported. WASPS is freely accessible at https://archaea.i2bc.paris-saclay.fr/wasps/.<h4>Supplementary information</h4>Supplementary data are available at Bioinformatics online.","hji,kes",1,0,1,2,0.5,database and software tools,"no notes; reassessed and still no - sounds like a service only to me, BLAST against a curated set of genomes",39,discuss
32291734,"The Auditory English Lexicon Project: A multi-talker, multi-region psycholinguistic database of 10,170 spoken words and nonwords.","The Auditory English Lexicon Project (AELP) is a multi-talker, multi-region psycholinguistic database of 10,170 spoken words and 10,170 spoken nonwords. Six tokens of each stimulus were recorded as 44.1-kHz, 16-bit, mono WAV files by native speakers of American, British, and Singapore English, with one from each gender. Intelligibility norms, as determined by average identification scores and confidence ratings from between 15 and 20 responses per token, were obtained from 561 participants. Auditory lexical decision accuracies and latencies, with between 25 and 36 responses per token, were obtained from 438 participants. The database also includes a variety of lexico-semantic variables and structural indices for the words and nonwords, as well as participants' individual difference measures such as age, gender, language background, and proficiency. Taken together, there are a total of 122,040 sound files and over 4 million behavioral data points in the AELP. We describe some of the characteristics of this database. This resource is freely available from a website ( https://inetapps.nus.edu.sg/aelp/ ) hosted by the Department of Psychology at the National University of Singapore.","hji,kes",1,1,2,2,1,auditory and lexical db,not life sci; reassessed and re-scored - based on broaded def of life sci,79,
32548865,The UK Veterinary Immunological Toolbox Website: promoting vaccine research by facilitating communication and removing reagent barriers.,"Using the best animal models to study immune responses against specific pathogens or vaccines can dramatically accelerate our understanding. Veterinary species are well studied, particularly livestock, to reduce their disease burden. They have also proven to be powerful models, especially for zoonotic pathogens and novel vaccination strategies. A prerequisite for any model selection is having the right quality and range of species-specific immunological reagents. To help promote the widest possible use of veterinary species, an open access website (https://www.immunologicaltoolbox.co.uk) has been created as a central community annotated hub for veterinary immunological reagents. The website is also the portal into services offered by the UK Immunological Toolbox project that includes antibody generation, sequencing and recombinant expression. The funding for this effort is linked into sustainable sources, but ultimate success relies on community engagement to continually increase the quality and quantity of information. It is hoped that as more users and reagent owners engage, it will become an essential resource for researchers, veterinarians and clinicians alike by removing barriers that prevent the use of the most informative animal models.","hji,kes",1,1,2,2,1,,no notes; reassessed and re-scored - re-score based on broaded def of life sci - a db of reagents I guess,101,
32657595,The First Inherited Retinal Disease Registry in Iran: Research Protocol and Results of a Pilot Study.,"<h4>Background</h4>To describe the protocol for developing a national inherited retinal disease (IRD) registry in Iran and present its initial report.<h4>Methods</h4>This community-based participatory research was approved by the Ministry of Health and Medical Education of Iran in 2016. To provide the minimum data set (MDS), several focus group meetings were held. The final MDS was handed over to an engineering team to develop a web-based software. In the pilot phase, the software was set up in two referral centers in Iran. Final IRD diagnosis was made based on clinical manifestations and genetic findings. Ultimately, patient registration was done based on all clinical and non-clinical manifestations.<h4>Results</h4>Initially, a total of 151 data elements were approved with Delphi technique. The registry software went live at www. IRDReg.org based on DHIS2 open source license agreement since February 2016. So far, a total of 1001 patients have been registered with a mean age of 32.41¬±15.60 years (range, 3 months to 74 years). The majority of the registered patients had retinitis pigmentosa (42%, 95% CI: 38.9% to 45%). Genetic testing was done for approximately 20% of the registered individuals.<h4>Conclusion</h4>Our study shows successful web-based software design and data collection as a proof of concept for the first IRD registry in Iran. Multicenter integration of the IRD registry in medical centers throughout the country is well underway as planned. These data will assist researchers to rapidly access information about the distribution and genetic patterns of this disease.","hji,kes",1,0,1,2,0.5,clinical data,registry; reassessed and still no - clinical registry,110,discuss
33016192,Curated gene expression dataset of differentiating 3T3-L1 adipocytes under pharmacological and genetic perturbations.,"The 3T3-L1 cell line is used as an adipocyte differentiation model for the analysis of genes specifically expressed during the differentiation course. This cell model has several applications in obesity and insulin resistance research. We built a data resource to model gene expression of differentiating and mature adipocytes in response to several drugs and gene manipulations. We surveyed the literature survey for microarray datasets of differentiating 3T3-L1 cell line sampled at one or more time points under genetic or pharmacological perturbations. Data and metadata were obtained from the gene expression omnibus. The metadata were manually curated using unified language across the studies. Probe intensities were mapped and collapsed to genes using a reproducible pipeline. Samples were classified into none, genetically or pharmacologically modified. In addition to the clean datasets, two aggregated sets were further homogenized for illustration purposes. The curated datasets are available as an R/Bioconductor experimental data package curatedAdipoArray. The package documents the source code of the data collection, curation and processing. Finally, we used a subset of the data to effectively remove batch effects and reproduce biological observations. <b>Database URL</b> https://bioconductor.org/packages/curatedAdipoArray.","hji,kes",1,0,1,2,0.5,curated dataset,described as a data resource but a bioconductor package; reassessed and still no - not includeing bioconductor packages,146,discuss
33083503,The babyPose dataset.,"The database here described contains data relevant to preterm infants' movement acquired in neonatal intensive care units (NICUs). The data consists of 16 depth videos recorded during the actual clinical practice. Each video consists of 1000 frames (i.e., 100s). The dataset was acquired at the NICU of the Salesi Hospital, Ancona (Italy). Each frame was annotated with the limb-joint location. Twelve joints were annotated, i.e., left and right shoul- der, elbow, wrist, hip, knee and ankle. The database is freely accessible at http://doi.org/10.5281/zenodo.3891404. This dataset represents a unique resource for artificial intelligence researchers that want to develop algorithms to provide healthcare professionals working in NICUs with decision support. Hence, the babyPose dataset is the first annotated dataset of depth images relevant to preterm infants' movement analysis.","hji,kes",1,0,1,2,0.5,manually annotated dataset,clinical data; reassessed and still no - clinincal data,158,
33095870,Database resources of the National Center for Biotechnology Information.,"The National Center for Biotechnology Information (NCBI) provides a large suite of online resources for biological information and data, including the GenBank¬Æ nucleic acid sequence database and the PubMed¬Æ database of citations and abstracts published in life science journals. The Entrez system provides search and retrieval operations for most of these data from 34 distinct databases. The E-utilities serve as the programming interface for the Entrez system. Custom implementations of the BLAST program provide sequence-based searching of many specialized datasets. New resources released in the past year include a new PubMed interface and NCBI datasets. Additional resources that were updated in the past year include PMC, Bookshelf, Genome Data Viewer, SRA, ClinVar, dbSNP, dbVar, Pathogen Detection, BLAST, Primer-BLAST, IgBLAST, iCn3D and PubChem. All of these resources can be accessed through the NCBI home page at https://www.ncbi.nlm.nih.gov.","hji,kes",1,0,1,2,0.5,description of interfaces and new NCBI data resources,like EBI - NCBI is not a data resource in and of itself; reassessed and still no - abstract does not describe or have urls for distinct resources,161,discuss
33175170,"Database Resources of the National Genomics Data Center, China National Center for Bioinformation in 2021.","The National Genomics Data Center (NGDC), part of the China National Center for Bioinformation (CNCB), provides a suite of database resources to support worldwide research activities in both academia and industry. With the explosive growth of multi-omics data, CNCB-NGDC is continually expanding, updating and enriching its core database resources through big data deposition, integration and translation. In the past year, considerable efforts have been devoted to 2019nCoVR, a newly established resource providing a global landscape of SARS-CoV-2 genomic sequences, variants, and haplotypes, as well as Aging Atlas, BrainBase, GTDB (Glycosyltransferases Database), LncExpDB, and TransCirc (Translation potential for circular RNAs). Meanwhile, a series of resources have been updated and improved, including BioProject, BioSample, GWH (Genome Warehouse), GVM (Genome Variation Map), GEN (Gene Expression Nebulas) as well as several biodiversity and plant resources. Particularly, BIG Search, a scalable, one-stop, cross-database search engine, has been significantly updated by providing easy access to a large number of internal and external biological resources from CNCB-NGDC, our partners, EBI and NCBI. All of these resources along with their services are publicly accessible at https://bigd.big.ac.cn.","hji,kes",1,0,1,2,0.5,description of several databases and biodata resources,like EBI - NGDC is not a data resource in and of itself; reassussed and still no - abstract does not describe or have urls for distinct resources,171,
33245775,The European Bioinformatics Institute: empowering cooperation in response to a global health crisis.,"The European Bioinformatics Institute (EMBL-EBI; https://www.ebi.ac.uk/) provides freely available data and bioinformatics services to the scientific community, alongside its research activity and training provision. The 2020 COVID-19 pandemic has brought to the forefront a need for the scientific community to work even more cooperatively to effectively tackle a global health crisis. EMBL-EBI has been able to build on its position to contribute to the fight against COVID-19 in a number of ways. Firstly, EMBL-EBI has used its infrastructure, expertise and network of international collaborations to help build the European COVID-19 Data Platform (https://www.covid19dataportal.org/), which brings together COVID-19 biomolecular data and connects it to researchers, clinicians and public health professionals. By September 2020, the COVID-19 Data Platform has integrated in excess of 170 000 COVID-19 biomolecular data and literature records, collected through a number of EMBL-EBI resources. Secondly, EMBL-EBI has strived to continue its support of the life science communities through the crisis, with updated Training provision and improved service provision throughout its resources. The COVID-19 pandemic has highlighted the importance of EMBL-EBI's core principles, including international cooperation, resource sharing and central data brokering, and has further empowered scientific cooperation.","hji,kes",1,0,1,2,0.5,COVID-19 Data Platform,EBI again; reassessed and still no - abstract does not describe or have urls for distinct resources,178,
33338203,MuscleAtlasExplorer: a web service for studying gene expression in human skeletal muscle.,"MuscleAtlasExplorer is a freely available web application that allows for the exploration of gene expression data from human skeletal muscle. It draws from an extensive publicly available dataset of 1654 skeletal muscle expression microarray samples. Detailed, manually curated, patient phenotype data, with information such as age, sex, BMI and disease status, are combined with skeletal muscle gene expression to provide insights into gene function in skeletal muscle. It aims to facilitate easy exploration of the data using powerful data visualization functions, while allowing for sample selection, in-depth inspection and further analysis using external tools. Availability: MuscleAtlasExplorer is available at https://mae.crc.med.lu.se/mae2 (username 'muscle' and password 'explorer' pre-publication).","hji,kes",1,0,1,2,0.5,not sure if it is a biodata resource in and of itself,"no notes; reassessed and no still - does talk about value add done to data, but still seems mostly like a web servcer",191,
33455583,Establishment and application of information resource of mutant mice in RIKEN BioResource Research Center.,"Online databases are crucial infrastructures to facilitate the wide effective and efficient use of mouse mutant resources in life sciences. The number and types of mouse resources have been rapidly growing due to the development of genetic modification technology with associated information of genomic sequence and phenotypes. Therefore, data integration technologies to improve the findability, accessibility, interoperability, and reusability of mouse strain data becomes essential for mouse strain repositories. In 2020, the RIKEN BioResource Research Center released an integrated database of bioresources including, experimental mouse strains, Arabidopsis thaliana as a laboratory plant, cell lines, microorganisms, and genetic materials using Resource Description Framework-related technologies. The integrated database shows multiple advanced features for the dissemination of bioresource information. The current version of our online catalog of mouse strains which functions as a part of the integrated database of bioresources is available from search bars on the page of the Center ( https://brc.riken.jp ) and the Experimental Animal Division ( https://mus.brc.riken.jp/ ) websites. The BioResource Research Center also released a genomic variation database of mouse strains established in Japan and Western Europe, MoG<sup>+</sup> ( https://molossinus.brc.riken.jp/mogplus/ ), and a database for phenotype-phenotype associations across the mouse phenome using data from the International Mouse Phenotyping Platform. In this review, we describe features of current version of databases related to mouse strain resources in RIKEN BioResource Research Center and discuss future views.","hji,kes",1,1,2,2,1,description of several databases and biodata resources,"like EBI - Riken is not a data resource in and of itself; reassessed and re-scored - does have one URL and name of a distinct resources, tricky abstract",212,
33477091,Chronic wounds multimodal image database.,"A multimodal wound image database was created to allow fast development of computer-aided approaches for wound healing monitoring. The developed system with parallel camera optical axes enables multimodal images: photo, thermal, stereo, and depth map of the wound area to be acquired. As a result of using this system a multimodal database of chronic wound images is introduced. It contains 188 image sets of photographs, thermal images, and 3D meshes of the surfaces of chronic wounds acquired during 79 patient visits. Manual wound outlines delineated by an expert are also included in the dataset. All images of each case are additionally coregistered, and both numerical registration parameters and the transformed images are covered in the database. The presented database is publicly available for the research community at https://chronicwounddatabase.eu. That is the first publicly available database for evaluation and comparison of new image-based algorithms in the wound healing monitoring process with coregistered photographs, thermal maps, and 3D models of the wound area. Easily available database of coregistered multimodal data with the raw data set allows faster development of algorithms devoted to wound healing analysis and monitoring.","hji,kes",1,0,1,2,0.5,,medical - out of scope; reassessed and still no - clincial data,216,
