id,title,abstract,checked_by,kes_check,hji_check,curation_sum,number_of_checks,curation_score,kes_notes,hji_notes,index,next_step
24165883,IMG 4 version of the integrated microbial genomes comparative analysis system.,"The Integrated Microbial Genomes (IMG) data warehouse integrates genomes from all three domains of life, as well as plasmids, viruses and genome fragments. IMG provides tools for analyzing and reviewing the structural and functional annotations of genomes in a comparative context. IMG's data content and analytical capabilities have increased continuously since its first version released in 2005. Since the last report published in the 2012 NAR Database Issue, IMG's annotation and data integration pipelines have evolved while new tools have been added for recording and analyzing single cell genomes, RNA Seq and biosynthetic cluster data. Different IMG datamarts provide support for the analysis of publicly available genomes (IMG/W: http://img.jgi.doe.gov/w), expert review of genome annotations (IMG/ER: http://img.jgi.doe.gov/er) and teaching and training in the area of microbial genome analysis (IMG/EDU: http://img.jgi.doe.gov/edu).","hji,kes",0,1,1,2,0.5,,no notes; reassessed and still yes - includes a data resource ,855,discuss
24178034,IDEAL in 2014 illustrates interaction networks composed of intrinsically disordered proteins and their binding partners.,"IDEAL (Intrinsically Disordered proteins with Extensive Annotations and Literature, http://www.ideal.force.cs.is.nagoya-u.ac.jp/IDEAL/) is a collection of intrinsically disordered proteins (IDPs) that cannot adopt stable globular structures under physiological conditions. Since its previous publication in 2012, the number of entries in IDEAL has almost tripled (120 to 340). In addition to the increase in quantity, the quality of IDEAL has been significantly improved. The new IDEAL incorporates the interactions of IDPs and their binding partners more explicitly, and illustrates the protein-protein interaction (PPI) networks and the structures of protein complexes. Redundant experimental data are arranged based on the clustering of Protein Data Bank entries, and similar sequences with the same binding mode are grouped. As a result, the new IDEAL presents more concise and informative experimental data. Nuclear magnetic resonance (NMR) disorder is annotated in a systematic manner, by identifying the regions with large deviations among the NMR models. The ordered/disordered and new domain predictions by DICHOT are available, as well as the domain assignments by HMMER. Some examples of the PPI networks and the highly deviated regions derived from NMR models will be described, together with other advances. These enhancements will facilitate deeper understanding of IDPs, in terms of their flexibility, plasticity and promiscuity.","hji,kes",0,1,1,2,0.5,,no notes; reassessed and still yes - includes a data resource ,856,kes review
24270792,Gene3D: Multi-domain annotations for protein sequence and comparative genome analysis.,"Gene3D (http://gene3d.biochem.ucl.ac.uk) is a database of protein domain structure annotations for protein sequences. Domains are predicted using a library of profile HMMs from 2738 CATH superfamilies. Gene3D assigns domain annotations to Ensembl and UniProt sequence sets including >6000 cellular genomes and >20 million unique protein sequences. This represents an increase of 45% in the number of protein sequences since our last publication. Thanks to improvements in the underlying data and pipeline, we see large increases in the domain coverage of sequences. We have expanded this coverage by integrating Pfam and SUPERFAMILY domain annotations, and we now resolve domain overlaps to provide highly comprehensive composite multi-domain architectures. To make these data more accessible for comparative genome analyses, we have developed novel search algorithms for searching genomes to identify related multi-domain architectures. In addition to providing domain family annotations, we have now developed a pipeline for 3D homology modelling of domains in Gene3D. This has been applied to the human genome and will be rolled out to other major organisms over the next year.","hji,kes",0,1,1,2,0.5,,no notes; reassessed and still yes - includes a data resource ,857,kes review
24319143,MMDB and VAST+: tracking structural similarities between macromolecular complexes.,"The computational detection of similarities between protein 3D structures has become an indispensable tool for the detection of homologous relationships, the classification of protein families and functional inference. Consequently, numerous algorithms have been developed that facilitate structure comparison, including rapid searches against a steadily growing collection of protein structures. To this end, NCBI's Molecular Modeling Database (MMDB), which is based on the Protein Data Bank (PDB), maintains a comprehensive and up-to-date archive of protein structure similarities computed with the Vector Alignment Search Tool (VAST). These similarities have been recorded on the level of single proteins and protein domains, comprising in excess of 1.5 billion pairwise alignments. Here we present VAST+, an extension to the existing VAST service, which summarizes and presents structural similarity on the level of biological assemblies or macromolecular complexes. VAST+ simplifies structure neighboring results and shows, for macromolecular complexes tracked in MMDB, lists of similar complexes ranked by the extent of similarity. VAST+ replaces the previous VAST service as the default presentation of structure neighboring data in NCBI's Entrez query and retrieval system. MMDB and VAST+ can be accessed via http://www.ncbi.nlm.nih.gov/Structure.","hji,kes",0,1,1,2,0.5,,no notes; reassessed and still yes - includes a data resource ,858,kes review
24372041,miRror2.0: a platform for assessing the joint action of microRNAs in cell regulation.,"microRNAs (miRNAs) are short, noncoding RNAs that negatively regulate the levels of mRNA post-transcriptionally. Recent experiments revealed thousands of mRNA-miRNA pairs in which multiple miRNAs may bind the same transcript. These results raised the notion of miRNAs teamwork for a wide range of cellular context. miRror2.0 utilizes the miRNA-target predictions from over a dozen programs and resources and unifies them under a common statistical basis. The platform, called miRror2.0, considers the combinatorial regulation by miRNAs in different tissues, cell lines and under a broad range of conditions. A flexible setting permits the selection of the preferred combination of miRNA-target prediction resources as well as the statistical parameters for the analysis. miRror2.0 covers six major model organisms including human and mouse. Importantly, the system is capable of analyzing hundreds of genes that were subjected to miRNAs' regulation. Activating miRror2.0 by introducing thousands of genes from miRNA overexpression experiments successfully identified the objective miRNAs. The output from miRror2.0 is a list of genes that is optimally regulated by a defined set of miRNAs. A symmetric application of miRror2.0 starts with a set of miRNAs, and the system then seeks the preferred set of genes that are regulated by that miRNA composition. The results from miRror2.0 are empowered by an iterative procedure called PSI-miRror. PSI-miRror tests the robustness of miRror2.0 prediction. It allows a refinement of the initial list of genes in view of the miRNAs that optimally regulate this list. We present miRror2.0 as a valuable resource for supporting cellular experimentalists that seek recovery of combinatorial regulation by miRNAs from noisy experimental data. miRror2.0 is available at http://www.mirrorsuite.cs.huji.ac.il .","hji,kes",0,0,0,2,0,,iffy; reassessed and re-scored - software,859,
24464816,PRIMSIPLR: prediction of inner-membrane situated pore-lining residues for alpha-helical transmembrane proteins.,"Transmembrane proteins such as transporters and channels mediate the passage of inorganic and organic substances across biological membranes through their central pore. Pore-lining residues (PLRs) that make direct contacts to the substrates have a crucial impact on the function of the protein and, hence, their identification is a key step in mechanistic studies. Here, we established a nonredundant data set containing the three-dimensional (3D) structures of 90 a-helical transmembrane proteins and annotated the PLRs of these proteins by a pore identification software. A support vector machine was then trained to distinguish PLRs from other residues based on the protein sequence alone. Using sixfold cross-validation, our best performing predictor gave a Matthews's correlation coefficient of 0.41 with an accuracy of 0.86, sensitivity of 0.61, and specificity of 0.89, respectively. We provide a novel software tool that will aid biomedical scientists working on transmembrane proteins with unknown 3D structures. Both standalone version and web service are freely available from the URL http://service.bioinformatik.uni-saarland.de/PRIMSIPLR/.","hji,kes",0,0,0,2,0,,seems to be both the tool and value add data; reassessed and re-scored - emphasize on the method,860,
24467687,Non-synonymous variations in cancer and their effects on the human proteome: workflow for NGS data biocuration and proteome-wide analysis of TCGA data.,"<h4>Background</h4>Next-generation sequencing (NGS) technologies have resulted in petabytes of scattered data, decentralized in archives, databases and sometimes in isolated hard-disks which are inaccessible for browsing and analysis. It is expected that curated secondary databases will help organize some of this Big Data thereby allowing users better navigate, search and compute on it.<h4>Results</h4>To address the above challenge, we have implemented a NGS biocuration workflow and are analyzing short read sequences and associated metadata from cancer patients to better understand the human variome. Curation of variation and other related information from control (normal tissue) and case (tumor) samples will provide comprehensive background information that can be used in genomic medicine research and application studies. Our approach includes a CloudBioLinux Virtual Machine which is used upstream of an integrated High-performance Integrated Virtual Environment (HIVE) that encapsulates Curated Short Read archive (CSR) and a proteome-wide variation effect analysis tool (SNVDis). As a proof-of-concept, we have curated and analyzed control and case breast cancer datasets from the NCI cancer genomics program - The Cancer Genome Atlas (TCGA). Our efforts include reviewing and recording in CSR available clinical information on patients, mapping of the reads to the reference followed by identification of non-synonymous Single Nucleotide Variations (nsSNVs) and integrating the data with tools that allow analysis of effect nsSNVs on the human proteome. Furthermore, we have also developed a novel phylogenetic analysis algorithm that uses SNV positions and can be used to classify the patient population. The workflow described here lays the foundation for analysis of short read sequence data to identify rare and novel SNVs that are not present in dbSNP and therefore provides a more comprehensive understanding of the human variome. Variation results for single genes as well as the entire study are available from the CSR website (http://hive.biochemistry.gwu.edu/dna.cgi?cmd=csr).<h4>Conclusions</h4>Availability of thousands of sequenced samples from patients provides a rich repository of sequence information that can be utilized to identify individual level SNVs and their effect on the human proteome beyond what the dbSNP database provides.","hji,kes",0,1,1,2,0.5,,database but password protected; reassessed and still yes - includes a data resource,861,
24580755,"CDSbank: taxonomy-aware extraction, selection, renaming and formatting of protein-coding DNA or amino acid sequences.","<h4>Background</h4>Protein-coding DNA sequences and their corresponding amino acid sequences are routinely used to study relationships between sequence, structure, function, and evolution. The rapidly growing size of sequence databases increases the power of such comparative analyses but it makes it more challenging to prepare high quality sequence data sets with control over redundancy, quality, completeness, formatting, and labeling. Software tools for some individual steps in this process exist but manual intervention remains a common and time consuming necessity.<h4>Description</h4>CDSbank is a database that stores both the protein-coding DNA sequence (CDS) and amino acid sequence for each protein annotated in Genbank. CDSbank also stores Genbank feature annotation, a flag to indicate incomplete 5' and 3' ends, full taxonomic data, and a heuristic to rank the scientific interest of each species. This rich information allows fully automated data set preparation with a level of sophistication that aims to meet or exceed manual processing. Defaults ensure ease of use for typical scenarios while allowing great flexibility when needed. Access is via a free web server at http://hazeslab.med.ualberta.ca/CDSbank/.<h4>Conclusions</h4>CDSbank presents a user-friendly web server to download, filter, format, and name large sequence data sets. Common usage scenarios can be accessed via pre-programmed default choices, while optional sections give full control over the processing pipeline. Particular strengths are: extract protein-coding DNA sequences just as easily as amino acid sequences, full access to taxonomy for labeling and filtering, awareness of incomplete sequences, and the ability to take one protein sequence and extract all synonymous CDS or identical protein sequences in other species. Finally, CDSbank can also create labeled property files to, for instance, annotate or re-label phylogenetic trees.","hji,kes",0,1,1,2,0.5,,no notes; reassessed and still yes - includes a data resource ,862,discuss
24655548,Analysis of growth factor signaling in genetically diverse breast cancer lines.,"<h4>Background</h4>Soluble growth factors present in the microenvironment play a major role in tumor development, invasion, metastasis, and responsiveness to targeted therapies. While the biochemistry of growth factor-dependent signal transduction has been studied extensively in individual cell types, relatively little systematic data are available across genetically diverse cell lines.<h4>Results</h4>We describe a quantitative and comparative dataset focused on immediate-early signaling that regulates the AKT (AKT1/2/3) and ERK (MAPK1/3) pathways in a canonical panel of well-characterized breast cancer lines. We also provide interactive web-based tools to facilitate follow-on analysis of the data. Our findings show that breast cancers are diverse with respect to ligand sensitivity and signaling biochemistry. Surprisingly, triple negative breast cancers (TNBCs; which express low levels of ErbB2, progesterone and estrogen receptors) are the most broadly responsive to growth factors and HER2amp cancers (which overexpress ErbB2) the least. The ratio of ERK to AKT activation varies with ligand and subtype, with a systematic bias in favor of ERK in hormone receptor positive (HR+) cells. The factors that correlate with growth factor responsiveness depend on whether fold-change or absolute activity is considered the key biological variable, and they differ between ERK and AKT pathways.<h4>Conclusions</h4>Responses to growth factors are highly diverse across breast cancer cell lines, even within the same subtype. A simple four-part heuristic suggests that diversity arises from variation in receptor abundance, an ERK/AKT bias that depends on ligand identity, a set of factors common to all receptors that varies in abundance or activity with cell line, and an """"indirect negative regulation"""" by ErbB2. This analysis sets the stage for the development of a mechanistic and predictive model of growth factor signaling in diverse cancer lines. Interactive tools for looking up these results and downloading raw data are available at http://lincs.hms.harvard.edu/niepel-bmcbiol-2014/.","hji,kes",0,1,1,2,0.5,,project website though; reassessed and still yes - raw data available,863,discuss
24678734,Research resource: EPSLiM: ensemble predictor for short linear motifs in nuclear hormone receptors.,"Nuclear receptors (NRs) are a superfamily of transcription factors central to regulating many biological processes, including cell growth, death, metabolism, and immune responses. NR-mediated gene expression can be modulated by coactivators and corepressors through direct physical interaction or protein complexes with functional domains in NRs. One class of these domains includes short linear motifs (SLiMs), which facilitate protein-protein interactions, phosphorylation, and ligand binding primarily in the intrinsically disordered regions (IDRs) of proteins. Across all proteins, the number of known SLiMs is limited due to the difficulty in studying IDRs experimentally. Computational tools provide a systematic and data-driven approach for predicting functional motifs that can be used to prioritize experimental efforts. Accordingly, several tools have been developed based on sequence conservation or biophysical features; however, discrepancies in predictions make it difficult to determine the true candidate SLiMs. In this work, we present the ensemble predictor for short linear motifs (EPSLiM), a novel strategy to prioritize the residues that are most likely to be SLiMs in IDRs. EPSLiM applies a generalized linear model to integrate predictions from individual methodologies. We show that EPSLiM outperforms individual predictors, and we apply our method to NRs. The androgen receptor is an example with an N-terminal domain of 559 disordered amino acids that contains several validated SLiMs important for transcriptional activation. We use the androgen receptor to illustrate the predictive performance of EPSLiM and make the results of all human and mouse NRs publically available through the web service http://epslim.bwh.harvard.edu.","hji,kes",0,1,1,2,0.5,,"resulting data is what's available; reassessed and still yes - tricky abstract, it's the data that's available",864,discuss
24727366,"'In silico expression analysis', a novel PathoPlant web tool to identify abiotic and biotic stress conditions associated with specific cis-regulatory sequences.","Using bioinformatics, putative cis-regulatory sequences can be easily identified using pattern recognition programs on promoters of specific gene sets. The abundance of predicted cis-sequences is a major challenge to associate these sequences with a possible function in gene expression regulation. To identify a possible function of the predicted cis-sequences, a novel web tool designated 'in silico expression analysis' was developed that correlates submitted cis-sequences with gene expression data from Arabidopsis thaliana. The web tool identifies the A. thaliana genes harbouring the sequence in a defined promoter region and compares the expression of these genes with microarray data. The result is a hierarchy of abiotic and biotic stress conditions to which these genes are most likely responsive. When testing the performance of the web tool, known cis-regulatory sequences were submitted to the 'in silico expression analysis' resulting in the correct identification of the associated stress conditions. When using a recently identified novel elicitor-responsive sequence, a WT-box (CGACTTTT), the 'in silico expression analysis' predicts that genes harbouring this sequence in their promoter are most likely Botrytis cinerea induced. Consistent with this prediction, the strongest induction of a reporter gene harbouring this sequence in the promoter is observed with B. cinerea in transgenic A. thaliana. DATABASE URL: http://www.pathoplant.de/expression_analysis.php.","hji,kes",0,1,1,2,0.5,,"no notes; reassessed and still yes - data, I think - iffy",865,discuss
24852251,StemCellNet: an interactive platform for network-oriented investigations in stem cell biology.,"Stem cells are characterized by their potential for self-renewal and their capacity to differentiate into mature cells. These two key features emerge through the interplay of various factors within complex molecular networks. To provide researchers with a dedicated tool to investigate these networks, we have developed StemCellNet, a versatile web server for interactive network analysis and visualization. It rapidly generates focused networks based on a large collection of physical and regulatory interactions identified in human and murine stem cells. The StemCellNet web-interface has various easy-to-use tools for selection and prioritization of network components, as well as for integration of expression data provided by the user. As a unique feature, the networks generated can be screened against a compendium of stemness-associated genes. StemCellNet can also indicate novel candidate genes by evaluating their connectivity patterns. Finally, an optional dataset of generic interactions, which provides large coverage of the human and mouse proteome, extends the versatility of StemCellNet to other biomedical research areas in which stem cells play important roles, such as in degenerative diseases or cancer. The StemCellNet web server is freely accessible at http://stemcellnet.sysbiolab.eu.","hji,kes",0,1,1,2,0.5,,iffy; reassessed and still yes - there is data there but it is iffy,866,
24885229,A comprehensive assessment of the transcriptome of cork oak (Quercus suber) through EST sequencing.,"<h4>Background</h4>Cork oak (Quercus suber) is one of the rare trees with the ability to produce cork, a material widely used to make wine bottle stoppers, flooring and insulation materials, among many other uses. The molecular mechanisms of cork formation are still poorly understood, in great part due to the difficulty in studying a species with a long life-cycle and for which there is scarce molecular/genomic information. Cork oak forests are of great ecological importance and represent a major economic and social resource in Southern Europe and Northern Africa. However, global warming is threatening the cork oak forests by imposing thermal, hydric and many types of novel biotic stresses. Despite the economic and social value of the Q. suber species, few genomic resources have been developed, useful for biotechnological applications and improved forest management.<h4>Results</h4>We generated in excess of 7 million sequence reads, by pyrosequencing 21 normalized cDNA libraries derived from multiple Q. suber tissues and organs, developmental stages and physiological conditions. We deployed a stringent sequence processing and assembly pipeline that resulted in the identification of ~159,000 unigenes. These were annotated according to their similarity to known plant genes, to known Interpro domains, GO classes and E.C. numbers. The phylogenetic extent of this ESTs set was investigated, and we found that cork oak revealed a significant new gene space that is not covered by other model species or EST sequencing projects. The raw data, as well as the full annotated assembly, are now available to the community in a dedicated web portal at http://www.corkoakdb.org.<h4>Conclusions</h4>This genomic resource represents the first trancriptome study in a cork producing species. It can be explored to develop new tools and approaches to understand stress responses and developmental processes in forest trees, as well as the molecular cascades underlying cork differentiation and disease response.","hji,kes",0,1,1,2,0.5,,no notes; reassessed and still yes - data available,867,
25119676,Improvements to pairwise sequence comparison (PASC): a genome-based web tool for virus classification.,"The number of viral genome sequences in the public databases is increasing dramatically, and these sequences are playing an important role in virus classification. Pairwise sequence comparison is a sequence-based virus classification method. A program using this method calculates the pairwise identities of virus sequences within a virus family and displays their distribution, and visual analysis helps to determine demarcations at different taxonomic levels such as strain, species, genus and subfamily. Subsequent comparison of new sequences against existing ones allows viruses from which the new sequences were derived to be classified. Although this method cannot be used as the only criterion for virus classification in some cases, it is a quantitative method and has many advantages over conventional virus classification methods. It has been applied to several virus families, and there is an increasing interest in using this method for other virus families/groups. The Pairwise Sequence Comparison (PASC) classification tool was created at the National Center for Biotechnology Information. The tool's database stores pairwise identities for complete genomes/segments of 56 virus families/groups. Data in the system are updated every day to reflect changes in virus taxonomy and additions of new virus sequences to the public database. The web interface of the tool ( http://www.ncbi.nlm.nih.gov/sutils/pasc/ ) makes it easy to navigate and perform analyses. Multiple new viral genome sequences can be tested simultaneously with this system to suggest the taxonomic position of virus isolates in a specific family. PASC eliminates potential discrepancies in the results caused by different algorithms and/or different data used by researchers.","hji,kes",0,1,1,2,0.5,,no notes; reassessed and still yes - data available,868,discuss
