id,title,abstract,checked_by,kes_check,hji_check,curation_sum,number_of_checks,curation_score,kes_notes,hji_notes,index,next_step
34125008,"The ""second wave"" of the COVID-19 pandemic in the Arctic: regional and temporal dynamics.","This article focuses on the ""second wave"" of the COVID-19 pandemic in the Arctic and examines spatiotemporal patterns between July 2020 and January 2021. We analyse available COVID-19 data at the regional (subnational) level to elucidate patterns and typology of Arctic regions with respect to the COVID-19 pandemic. This article builds upon our previous research that examined the early phase of the COVID-19 pandemic between February and July 2020. The pandemic's ""second wave"" observed in the Arctic between September 2020 and January 2021 was severe in terms of COVID-19 infections and fatalities, having particularly strong impacts in Alaska, Northern Russia and Northern Sweden. Based on the spatiotemporal patterns of the ""second wave"" dynamics, we identified 5 types of the pandemic across regions: Shockwaves (Iceland, Faroe Islands, Northern Norway, and Northern Finland), Protracted Waves (Northern Sweden), Tidal Waves (Northern Russia), Tsunami Waves (Alaska), and Isolated Splashes (Northern Canada and Greenland). Although data limitations and gaps persist, monitoring of COVID-19 is critical for developing a proper understanding of the pandemic in order to develop informed and effective responses to the current crisis and possible future pandemics in the Arctic. Data used in this paper are available at https://arctic.uni.edu/arctic-covid-19.","hji,kes",0,0,0,2,0,,"vis/dashboard; assessed and re-scored - says data available but abstract is otherwise describing viz, tricky abstract",623,
21249531,The DIADEM data sets: representative light microscopy images of neuronal morphology to advance automation of digital reconstructions.,"The comprehensive characterization of neuronal morphology requires tracing extensive axonal and dendritic arbors imaged with light microscopy into digital reconstructions. Considerable effort is ongoing to automate this greatly labor-intensive and currently rate-determining process. Experimental data in the form of manually traced digital reconstructions and corresponding image stacks play a vital role in developing increasingly more powerful reconstruction algorithms. The DIADEM challenge (short for DIgital reconstruction of Axonal and DEndritic Morphology) successfully stimulated progress in this area by utilizing six data set collections from different animal species, brain regions, neuron types, and visualization methods. The original research projects that provided these data are representative of the diverse scientific questions addressed in this field. At the same time, these data provide a benchmark for the types of demands automated software must meet to achieve the quality of manual reconstructions while minimizing human involvement. The DIADEM data underwent extensive curation, including quality control, metadata annotation, and format standardization, to focus the challenge on the most substantial technical obstacles. This data set package is now freely released ( http://diademchallenge.org ) to train, test, and aid development of automated reconstruction algorithms.","hji,kes",0,1,1,2,0.5,,no notes; reassessed and still yes - data sets ,812,discuss
21303543,An EST-based analysis identifies new genes and reveals distinctive gene expression features of Coffea arabica and Coffea canephora.,"<h4>Background</h4>Coffee is one of the world's most important crops; it is consumed worldwide and plays a significant role in the economy of producing countries. Coffea arabica and C. canephora are responsible for 70 and 30% of commercial production, respectively. C. arabica is an allotetraploid from a recent hybridization of the diploid species, C. canephora and C. eugenioides. C. arabica has lower genetic diversity and results in a higher quality beverage than C. canephora. Research initiatives have been launched to produce genomic and transcriptomic data about Coffea spp. as a strategy to improve breeding efficiency.<h4>Results</h4>Assembling the expressed sequence tags (ESTs) of C. arabica and C. canephora produced by the Brazilian Coffee Genome Project and the Nestl-Cornell Consortium revealed 32,007 clusters of C. arabica and 16,665 clusters of C. canephora. We detected different GC3 profiles between these species that are related to their genome structure and mating system. BLAST analysis revealed similarities between coffee and grape (Vitis vinifera) genes. Using KA/KS analysis, we identified coffee genes under purifying and positive selection. Protein domain and gene ontology analyses suggested differences between Coffea spp. data, mainly in relation to complex sugar synthases and nucleotide binding proteins. OrthoMCL was used to identify specific and prevalent coffee protein families when compared to five other plant species. Among the interesting families annotated are new cystatins, glycine-rich proteins and RALF-like peptides. Hierarchical clustering was used to independently group C. arabica and C. canephora expression clusters according to expression data extracted from EST libraries, resulting in the identification of differentially expressed genes. Based on these results, we emphasize gene annotation and discuss plant defenses, abiotic stress and cup quality-related functional categories.<h4>Conclusion</h4>We present the first comprehensive genome-wide transcript profile study of C. arabica and C. canephora, which can be freely assessed by the scientific community at http://www.lge.ibi.unicamp.br/coffea. Our data reveal the presence of species-specific/prevalent genes in coffee that may help to explain particular characteristics of these two crops. The identification of differentially expressed transcripts offers a starting point for the correlation between gene expression profiles and Coffea spp. developmental traits, providing valuable insights for coffee breeding and biotechnology, especially concerning sugar metabolism and stress tolerance.","hji,kes",0,1,1,2,0.5,,"iffy - project website but aggregated and value add, looks like it'd be in risk if the data aren't elsewhere; reassessed and still yes - data there",813,
21398672,"Histogram-based DNA analysis for the visualization of chromosome, genome and species information.","<h4>Motivation</h4>We describe a novel approach to explore DNA nucleotide sequence data, aiming to produce high-level categorical and structural information about the underlying chromosomes, genomes and species.<h4>Results</h4>The article starts by analyzing chromosomal data through histograms using fixed length DNA sequences. After creating the DNA-related histograms, a correlation between pairs of histograms is computed, producing a global correlation matrix. These data are then used as input to several data processing methods for information extraction and tabular/graphical output generation. A set of 18 species is processed and the extensive results reveal that the proposed method is able to generate significant and diversified outputs, in good accordance with current scientific knowledge in domains such as genomics and phylogenetics.<h4>Availability and implementation</h4>Source code freely available for download at http://www4.dei.isep.ipp.pt/etc/dnapaper2010, implemented in Free Pascal and UNIX scripting tools. Study input data available online for download at University of California at Santa Cruz Genome Bioinformatics, http://hgdownload.cse.ucsc.edu/downloads.html.","hji,kes",0,1,1,2,0.5,,iffy; reassessed and still yes - there is data there but it is iffy,814,
21411447,Using computational predictions to improve literature-based Gene Ontology annotations: a feasibility study.,"Annotation using Gene Ontology (GO) terms is one of the most important ways in which biological information about specific gene products can be expressed in a searchable, computable form that may be compared across genomes and organisms. Because literature-based GO annotations are often used to propagate functional predictions between related proteins, their accuracy is critically important. We present a strategy that employs a comparison of literature-based annotations with computational predictions to identify and prioritize genes whose annotations need review. Using this method, we show that comparison of manually assigned 'unknown' annotations in the Saccharomyces Genome Database (SGD) with InterPro-based predictions can identify annotations that need to be updated. A survey of literature-based annotations and computational predictions made by the Gene Ontology Annotation (GOA) project at the European Bioinformatics Institute (EBI) across several other databases shows that this comparison strategy could be used to maintain and improve the quality of GO annotations for other organisms besides yeast. The survey also shows that although GOA-assigned predictions are the most comprehensive source of functional information for many genomes, a large proportion of genes in a variety of different organisms entirely lack these predictions but do have manual annotations. This underscores the critical need for manually performed, literature-based curation to provide functional information about genes that are outside the scope of widely used computational methods. Thus, the combination of manual and computational methods is essential to provide the most accurate and complete functional annotation of a genome. Database URL: http://www.yeastgenome.org.","hji,kes",0,1,1,2,0.5,,no notes; reassessed and still yes - includes a data resource ,815,
21464845,An ANN model for the identification of deleterious nsSNPs in tumor suppressor genes.,"<h4>Unlabelled</h4>Human genetic variations primarily result from single nucleotide polymorphisms (SNPs) that occurs approximately every 1000 bases in the overall human population. The non-synonymous SNPs (nsSNPs), lead to amino acid changes in the protein product may account for nearly half of the known genetic variations linked to inherited human diseases and cancer. One of the main problems of medical genetics today is to identify nsSNPs that underlie disease-related phenotypes in humans. An attempt was made to develop a new approach to predict such nsSNPs. This would enhance our understanding of genetic diseases and helps to predict the disease. We detect nsSNPs and all possible and reliable alleles by ANN, a soft computing model using potential SNP information. Reliable nsSNPs are identified, based on the reconstructed alleles and on sequence redundancy. The model gives good results with mean specificity (95.85&), sensitivity (97.40&) and accuracy (96.25&). Our results indicate that ANNs can serve as a useful method to analyze quantitative effect of nsSNPs on protein function and would be useful for large-scale analysis of genomic nsSNP data.<h4>Availability</h4>The database is available for free at http://www.snp.mirworks.in.","hji,kes",0,0,0,2,0,,"no notes; reassessed and re-scored - says database available but abstract is entirely about the ANN method, iffy",816,
21523935,ncRNA consensus secondary structure derivation using grammar strings.,"Many noncoding RNAs (ncRNAs) function through both their sequences and secondary structures. Thus, secondary structure derivation is an important issue in today's RNA research. The state-of-the-art structure annotation tools are based on comparative analysis, which derives consensus structure of homologous ncRNAs. Despite promising results from existing ncRNA aligning and consensus structure derivation tools, there is a need for more efficient and accurate ncRNA secondary structure modeling and alignment methods. In this work, we introduce a consensus structure derivation approach based on grammar string, a novel ncRNA secondary structure representation that encodes an ncRNA's sequence and secondary structure in the parameter space of a context-free grammar (CFG) and a full RNA grammar including pseudoknots. Being a string defined on a special alphabet constructed from a grammar, grammar string converts ncRNA alignment into sequence alignment. We derive consensus secondary structures from hundreds of ncRNA families from BraliBase 2.1 and 25 families containing pseudoknots using grammar string alignment. Our experiments have shown that grammar string-based structure derivation competes favorably in consensus structure quality with Murlet and RNASampler. Source code and experimental data are available at http://www.cse.msu.edu/~yannisun/grammar-string.","hji,kes",0,0,0,2,0,,no notes; reassessed and re-scored - says data available but abstract emphasizes method,817,
21569303,Meta-analysis of heterogeneous Down Syndrome data reveals consistent genome-wide dosage effects related to neurological processes.,"<h4>Background</h4>Down syndrome (DS; trisomy 21) is the most common genetic cause of mental retardation in the human population and key molecular networks dysregulated in DS are still unknown. Many different experimental techniques have been applied to analyse the effects of dosage imbalance at the molecular and phenotypical level, however, currently no integrative approach exists that attempts to extract the common information.<h4>Results</h4>We have performed a statistical meta-analysis from 45 heterogeneous publicly available DS data sets in order to identify consistent dosage effects from these studies. We identified 324 genes with significant genome-wide dosage effects, including well investigated genes like SOD1, APP, RUNX1 and DYRK1A as well as a large proportion of novel genes (N = 62). Furthermore, we characterized these genes using gene ontology, molecular interactions and promoter sequence analysis. In order to judge relevance of the 324 genes for more general cerebral pathologies we used independent publicly available microarry data from brain studies not related with DS and identified a subset of 79 genes with potential impact for neurocognitive processes. All results have been made available through a web server under http://ds-geneminer.molgen.mpg.de/.<h4>Conclusions</h4>Our study represents a comprehensive integrative analysis of heterogeneous data including genome-wide transcript levels in the domain of trisomy 21. The detected dosage effects build a resource for further studies of DS pathology and the development of new therapies.","hji,kes",0,1,1,2,0.5,,no notes; reassessed and still yes -  abstract emphasizes the data to me,818,
21643562,Toxicity tests aiming to protect Brazilian aquatic systems: current status and implications for management.,"The current status of toxicological tests performed with Brazilian native species was evaluated through a survey of the scientific data available in the literature. The information gathered was processed and an electronic toxicology database (http://www.inct-ta.furg.br/bd_toxicologico.php) was generated. This database provides valuable information for researchers to select sensitive and tolerant aquatic species to a large variety of aquatic pollutants. Furthermore, the toxicology database allows researchers to select species representative of an ecosystem of interest. Analysis of the toxicology database showed that ecotoxicological assays have significantly improved in Brazil over the last decade, in spite of the still relatively low number of tests performed and the restricted number of native species tested. This is because most of the research is developed in a few laboratories concentrated in certain regions of Brazil, especially in Southern and Southeast regions. Considering the extremely rich biodiversity and the large variety of aquatic ecosystems in Brazil, this finding points to the urgent need for the development of ecotoxicological studies with other groups of aquatic animals, such as insects, foraminifera, cnidarians, worms, amphibians, among others. This would help to derive more realistic water quality criteria (WQC) values, which would better protect the different aquatic ecosystems in Brazil. Finally, the toxicology database generated presents solid and science based information, which can encourage and drive the Environmental Regulatory Agencies in Brazil to derive WQC based on native species. In this context, the present paper discusses the historical evolution of ecotoxicological studies in Brazil, and how they have contributed to the improvement of the Brazilian Federal and Regional regulations for environment.","hji,kes",0,1,1,2,0.5,,no notes; reassessed and still yes - includes a data resource ,819,kes review
21646342,"CSpritz: accurate prediction of protein disorder segments with annotation for homology, secondary structure and linear motifs.","CSpritz is a web server for the prediction of intrinsic protein disorder. It is a combination of previous Spritz with two novel orthogonal systems developed by our group (Punch and ESpritz). Punch is based on sequence and structural templates trained with support vector machines. ESpritz is an efficient single sequence method based on bidirectional recursive neural networks. Spritz was extended to filter predictions based on structural homologues. After extensive testing, predictions are combined by averaging their probabilities. The CSpritz website can elaborate single or multiple predictions for either short or long disorder. The server provides a global output page, for download and simultaneous statistics of all predictions. Links are provided to each individual protein where the amino acid sequence and disorder prediction are displayed along with statistics for the individual protein. As a novel feature, CSpritz provides information about structural homologues as well as secondary structure and short functional linear motifs in each disordered segment. Benchmarking was performed on the very recent CASP9 data, where CSpritz would have ranked consistently well with a Sw measure of 49.27 and AUC of 0.828. The server, together with help and methods pages including examples, are freely available at URL: http://protein.bio.unipd.it/cspritz/.","hji,kes",0,0,0,2,0,,iffy; reassessed and re-scored - no data,820,
21786137,Prediction of protein-protein interactions between Ralstonia solanacearum and Arabidopsis                      thaliana.,"Ralstonia solanacearum is a devastating bacterial pathogen that has an unusually wide host range. R. solanacearum, together with Arabidopsis thaliana, has become a model system for studying the molecular basis of plant-pathogen interactions. Protein-protein interactions (PPIs) play a critical role in the infection process, and some PPIs can initiate a plant defense response. However, experimental investigations have rarely addressed such PPIs. Using two computational methods, the interolog and the domain-based methods, we predicted 3,074 potential PPIs between 119 R. solanacearum and 1,442 A. thaliana proteins. Interestingly, we found that the potential pathogen-targeted proteins are more important in the A. thaliana PPI network. To facilitate further studies, all predicted PPI data were compiled into a database server called PPIRA (http://protein.cau.edu.cn/ppira/). We hope that our work will provide new insights for future research addressing the pathogenesis of R. solanacearum.","hji,kes",0,1,1,2,0.5,,no notes; reassessed and still yes - includes a data resource ,821,kes review
21854555,A first-generation integrated tammar wallaby map and its use in creating a tammar wallaby first-generation virtual genome map.,"<h4>Background</h4>The limited (2X) coverage of the tammar wallaby (Macropus eugenii) genome sequence dataset currently presents a challenge for assembly and anchoring onto chromosomes. To provide a framework for this assembly, it would be a great advantage to have a dense map of the tammar wallaby genome. However, only limited mapping data are available for this non-model species, comprising a physical map and a linkage map.<h4>Results</h4>We combined all available tammar wallaby mapping data to create a tammar wallaby integrated map, using the Location DataBase (LDB) strategy. This first-generation integrated map combines all available information from the second-generation tammar wallaby linkage map with 148 loci, and extensive FISH mapping data for 492 loci, especially for genes likely to be located at the ends of wallaby chromosomes or at evolutionary breakpoints inferred from comparative information. For loci whose positions are only approximately known, their location in the integrated map was refined on the basis of comparative information from opossum (Monodelphis domestica) and human. Interpolation of segments from the opossum and human assemblies into the integrated map enabled the subsequent construction of a tammar wallaby first-generation virtual genome map, which comprises 14336 markers, including 13783 genes recruited from opossum and human assemblies. Both maps are freely available at http://compldb.angis.org.au.<h4>Conclusions</h4>The first-generation integrated map and the first-generation virtual genome map provide a backbone for the chromosome assembly of the tammar wallaby genome sequence. For example, 78% of the 10257 gene-scaffolds in the Ensembl annotation of the tammar wallaby genome sequence (including 10522 protein-coding genes) can now be given a chromosome location in the tammar wallaby virtual genome map.","hji,kes",0,1,1,2,0.5,,"iffy - data from elsewhere, but integrated, may count then, but not available so will fall out later; reassessed and still yes - data, though iffy",822,
21880147,An integrative approach to ortholog prediction for disease-focused and other functional studies.,"<h4>Background</h4>Mapping of orthologous genes among species serves an important role in functional genomics by allowing researchers to develop hypotheses about gene function in one species based on what is known about the functions of orthologs in other species. Several tools for predicting orthologous gene relationships are available. However, these tools can give different results and identification of predicted orthologs is not always straightforward.<h4>Results</h4>We report a simple but effective tool, the Drosophila RNAi Screening Center Integrative Ortholog Prediction Tool (DIOPT; http://www.flyrnai.org/diopt), for rapid identification of orthologs. DIOPT integrates existing approaches, facilitating rapid identification of orthologs among human, mouse, zebrafish, C. elegans, Drosophila, and S. cerevisiae. As compared to individual tools, DIOPT shows increased sensitivity with only a modest decrease in specificity. Moreover, the flexibility built into the DIOPT graphical user interface allows researchers with different goals to appropriately 'cast a wide net' or limit results to highest confidence predictions. DIOPT also displays protein and domain alignments, including percent amino acid identity, for predicted ortholog pairs. This helps users identify the most appropriate matches among multiple possible orthologs. To facilitate using model organisms for functional analysis of human disease-associated genes, we used DIOPT to predict high-confidence orthologs of disease genes in Online Mendelian Inheritance in Man (OMIM) and genes in genome-wide association study (GWAS) data sets. The results are accessible through the DIOPT diseases and traits query tool (DIOPT-DIST; http://www.flyrnai.org/diopt-dist).<h4>Conclusions</h4>DIOPT and DIOPT-DIST are useful resources for researchers working with model organisms, especially those who are interested in exploiting model organisms such as Drosophila to study the functions of human disease genes.","hji,kes",0,1,1,2,0.5,,"no notes; reassessed and still yes - includes a data resource, it seems",823,
21929785,The representation of protein complexes in the Protein Ontology (PRO).,"<h4>Background</h4>Representing species-specific proteins and protein complexes in ontologies that are both human- and machine-readable facilitates the retrieval, analysis, and interpretation of genome-scale data sets. Although existing protin-centric informatics resources provide the biomedical research community with well-curated compendia of protein sequence and structure, these resources lack formal ontological representations of the relationships among the proteins themselves. The Protein Ontology (PRO) Consortium is filling this informatics resource gap by developing ontological representations and relationships among proteins and their variants and modified forms. Because proteins are often functional only as members of stable protein complexes, the PRO Consortium, in collaboration with existing protein and pathway databases, has launched a new initiative to implement logical and consistent representation of protein complexes.<h4>Description</h4>We describe here how the PRO Consortium is meeting the challenge of representing species-specific protein complexes, how protein complex representation in PRO supports annotation of protein complexes and comparative biology, and how PRO is being integrated into existing community bioinformatics resources. The PRO resource is accessible at http://pir.georgetown.edu/pro/.<h4>Conclusion</h4>PRO is a unique database resource for species-specific protein complexes. PRO facilitates robust annotation of variations in composition and function contexts for protein complexes within and between species.","hji,kes",0,1,1,2,0.5,,no notes; reassessed and still yes - includes a data resource ,824,kes review
